{
  "$schema": "https://json-schema.org/draft/2020-12/schema",
  "$id": "https://ga.example/contracts/contract-link/v1/contract-link-batch.schema.json",
  "title": "계약 연결 배치(인바운드, v1)",
  "description": "보험사·청약 시스템의 체결 계약을 확인서에 연결하는 입력(6B 계획 §4). 실제 피드 형식은 미정(설계서 §14 #16) — 어댑터(CSV·JSON 파일, HTTP)가 그 형식을 이 모양으로 바꾼다. 증권·청약 번호의 실제 형식은 모르므로 공백 없는 1~64자만 요구한다(§14 #19). 고객은 가명(customerRef)으로만 — 이름·연락처·생년월일을 받지 않는다. 형식 검사는 format이 아니라 pattern.",
  "type": "object",
  "additionalProperties": false,
  "required": ["schemaVersion", "source", "batchId", "items"],
  "properties": {
    "schemaVersion": { "const": 1 },
    "source": { "type": "string", "pattern": "^[A-Z][A-Z0-9_]{0,31}$", "description": "피드 출처(예: 보험사 코드·청약 시스템). 같은 (source, batchId, 항목 순번)은 한 번만 연결된다." },
    "batchId": { "type": "string", "pattern": "^[A-Za-z0-9._:-]{1,64}$" },
    "items": {
      "type": "array",
      "minItems": 1,
      "maxItems": 5000,
      "description": "한 트랜잭션 묶음의 상한 5,000 — 큰 피드는 어댑터가 나눈다. 항목은 서로 독립(한 항목의 거부가 배치를 막지 않는다).",
      "items": {
        "type": "object",
        "additionalProperties": false,
        "required": ["policyNo", "contractDate", "insurerCode"],
        "properties": {
          "policyNo": { "type": "string", "pattern": "^\\S{1,64}$" },
          "applicationNo": { "type": "string", "pattern": "^\\S{1,64}$" },
          "contractDate": { "type": "string", "pattern": "^\\d{4}-\\d{2}-\\d{2}$" },
          "insurerCode": { "type": "string", "pattern": "^[A-Z0-9][A-Z0-9-]{0,7}$", "description": "엔진 계약 1.2.0 InsurerCode와 같다(예: INS-A)." },
          "customerRef": { "type": "string", "pattern": "^[A-Za-z0-9][A-Za-z0-9_.-]{0,63}$" },
          "productKey": { "type": "string", "maxLength": 40, "pattern": "^[A-Z0-9][A-Z0-9-]{0,7}:[A-Za-z0-9][A-Za-z0-9._-]{0,30}$" }
        }
      }
    }
  }
}
